{
  "skill_path": "/Users/sshukla/Desktop/src/pydantic-agents/.cursor/skills/finance-variance",
  "evals_path": "/Users/sshukla/Desktop/src/pydantic-agents/.cursor/skills/finance-variance/evals/evals.json",
  "baseline_type": "without_skill",
  "runs_per_configuration": 1,
  "notes": "Iteration 2: fix float formatting in variance.csv numeric columns (10000 not 10000.0)."
}
